Title,Price,Currency,Seller FB,Signals
"Razer Huntsman Gaming Keyboard: Fastest Keyboard Switches Ever, Clicky Optical Switches, Customizable Chroma RGB Lighting, Programmable Macro Functionality, Gears of War 5 Edition",0.00,USD,0,5.00
"Personality Mouse Pad with Coaster Set, Giraffe with Floral Headgear Fashion Design Mouse Pad Non-Slip Rubber Gaming Mouse pad Computer Laptop",0.00,USD,0,5.00
Advanced Racing Seat Driving Simulator Gaming Chair with Gear Shifter Mount (Black),0.00,USD,0,5.00
"Ultra PRO - Foundations Liliana 100+ Deck Box Dark for Magic: The Gathering, Gaming gear, collector's item, gift gamers, compact organizer premium accessory, secure holder, vibrant artwork MTG Liliana",0.00,USD,0,5.00
"Faluber Cooling Gel Wrist Rest, 17.3-inch Length for Full-Sized Keyboard, Memory Foam Palm Rest with Non-Slip Footpad, Ergonomic Design, Stain Resistant, PC Accessory Gaming Gear (Large-Full Size)",0.00,USD,0,5.00
"4 in 1 Mouse Pad Combo, Large Gaming Mouse Pad + Keyboard Wrist Support + Mouse Wrist Rest + Coaster, Table Pad with Stitched Edge Memory Foam Ergonomic Wrist Pad Set, Giraffe with Floral Headgear",0.00,USD,0,5.00
Pulsar Gaming Gears SUPERGRIP Pre-Cut 2 Universal Griptape Pre-Laminated Sweat Absorbing High Performance Universal Anti Slip Mouse Grip Tape Ultra-Thin 0.5mm (0.02in),0.00,USD,0,5.00
"Ergonomic Office Chair, Mesh Desk Chair with Footrest, Adjustable Lumbar Support, 3D Armrest & Large Headrest, 3-Gear Tilt Recline, Stable Swivel Computer Gaming Chairs for Man Woman",0.00,USD,0,5.00
"USA Gear PS4 Pro & PS3 Console Carrying Case Bag with Adjustable Shoulder Strap, Padded Interior & Multi-Function Storage Compartments Works with PlayStation System & Gaming Accessories & More",0.00,USD,0,5.00
"muso wood Headphone Stand & Desktop Headset Holder | Space-Saving Premium Solid Wood Storage Base for Gaming Headsets, AirPods Max, VR Gear – Modern Desktop/Workspace Essential",0.00,USD,0,5.00
Pulsar Gaming Gears Superglide - Fastest and Smoothest Mouse Feet/Skates Made with Ultra Strong Flawless Glass Super Fast Smooth and Durable Sole for Xtrfy MZ1 Wireless,0.00,USD,0,5.00
"Vintage Video Gaming Console Controller Patent Prints, 6 (8x10) Unframed Photos, Wall Art Decor Gift for Home Office Gears Work Garage Man Cave Shop College Student Teacher ComicCon Nintendo Fan",0.00,USD,0,5.00
"Razer Goliathus Extended Chroma Gaming Mouse Pad: Customizable Chroma RGB Lighting, Soft, Cloth Material, Balanced Control & Speed, Non-Slip Rubber Base, Gears of WAR 5 Edition",0.00,USD,0,5.00
"Mouse Pad for Computers,Gaming Mouse-Pads Office for Laptop Mouse Mat for PC Non Slip Mice Pad Angler Fisherman Bass Lure Fly Fishing Gear 2T1559",0.00,USD,0,5.00
"USA Gear PS5 Carrying Case - Travel Bag Compatible with PlayStation 5, PS5 Slim with Adjustable Interior - Shoulder Travel Case for Dualsense Controllers, Playstation 5 Games, Accessories",0.00,USD,0,5.00
"USA Gear Console Carrying Case - Xbox Travel Bag Compatible with Xbox One and Series S with Water Resistant Exterior and Accessory Storage for Controllers, Cables, Gaming Headsets and More",0.00,USD,0,5.00
CampLiner Loot Drop box storage box fabric construction great for parties and long term storage of gaming gear.,0.00,USD,0,5.00
NEO TACTICAL GEAR Pokenade Grenade PVC Morale Patch - Funny & Tactical Patch for Backpacks and Collectors - RES & Gaming Patches,0.00,USD,0,5.00
"Roller blade Office Chair Wheels for Gaming Chair, 3 inch Replacement Rubber Casters for Hardwood Floors & Carpet, Ultra Smooth & Quiet Heavy Duty Desk Chair Wheels, Set of 5 (Red Blaze)",0.00,USD,0,5.00
"Logitech G840 K/DA XL Cloth Gaming Mouse Pad - 0.12 in Thin, Stable Rubber Base, Official League of Legends Gaming Gear",0.00,USD,0,5.00
"360° Rotatable Magnetic Phone Holder for Gym, Workout Phone Magnet Mount, Portable Gym Accessories Attach to Metal Surface, Universal Phone Stand for Content Creation Compatible with All Smartphones",0.00,USD,0,5.00
"NEEWER Magnetic Phone Tripod Stand Mount Adapter with Adhesive Metal Ring 1/4"" Thread Accessories Compatible with MagSafe iPhone 16 Pro Max 15 14 13 12 Selfie Stick Holder for Video Recording, PA080",0.00,USD,0,5.00
"Pnitri 2025 New Upgraded Bike Phone Holder Handlebar - 1S Quick Install, Motorcycle Phone Mount, Bicycle Phone Holder fit Large Phone Case for iPhone Samsung, Dirt Scooter Mini Bike Accessories",0.00,USD,0,5.00
"JSAUX Cell Phone Stand, Foldable Aluminum Adjustable Phone Holder for Desk Portable Travel Essentials Office Accessories for iPhone 17 16 15 14 13 Pro Max Samsung S25 S24 S23 Ultra Kindle-Gray",0.00,USD,0,5.00
"38W USB C Car Charger Adapter, 20W Fast USB-C & 18W Rapid QC3.0 Ports, 12V Cigarette Lighter Adapter for iPhone 17/16 /15, Google Pixel, Samsung, Android Phones Auto Accessories for Men - Gray",0.00,USD,0,5.00
"Adjustable Cell Phone Stand, CreaDream Phone Stand, Cradle, Dock, Holder, Aluminum Desktop Stand Compatible With Phone Xs Max Xr 8 7 6 6s Plus SE Charging, Accessories Desk,All Mobile Phones-Navy Blue",0.00,USD,0,5.00
"Lamicall Cell Phone Stand, Desk Accessories - Clear Office Cell Phone Holder, Acrylic Phone Stand, Desktop, Acrylic Office Desk Accessories, Office Decor, Suitable for iPhone, 4-8'' Phone",0.00,USD,0,5.00
"Lamicall Adjustable Cell Phone Stand, Desk Phone Holder, Cradle, Dock, Compatible with iPhone 17 16 15 14 Air Plus Pro Pro Max 13 12 X XS, 4-8"" Phones, Office Accessories, All Smartphone, Black",0.00,USD,0,5.00
"Crpich Acrylic Cell Phone Stand, Portable Clear Phone Stand for Desk, Compatible with Phone16 15 14 13 Pro Max Mini 12 11 Plus SE, Switch, Android Smartphone, Pad, Tablet, Desk Accessories",0.00,USD,0,5.00
12 Pcs Metal Phone Finger Grip Hook Adhesive Heart Shaped Phone Charm Hook Smartphones Accessories Charm Loop Stand Keychain Ring Smartphones Holder Heart Pad Ring for DIY Hanging Supplies (Silver),0.00,USD,0,5.00
"120W for iPhone 17 Pro Car Charger USB C, 4-Port Car Charger Fast Charging, PD&QC3.0 Type C Car Phone Charger, Cigarette Lighter Adapter, Car Accessories for iPhone 16 16e 15 17 Air Pro Max, Samsung",0.00,USD,0,5.00
KDD Dual Headphone Stand for Desk - Rotatable Headset Hanger with Phone Holder - Removable Non-Slip Base for Gamers Desktop Accessories,0.00,USD,0,5.00
2-IN-1 Car Phone Holder for Magsafe【28 Strong Magnets】Magnetic Phone Holder for Car Phone Mount【360°】Phone Holders for Your Car Accessories for Women Men for iPhone 17 Pro Max 16 15 14 13 12 Air Plus,0.00,USD,0,5.00
"Retractable Car Charger, 84W Car Charger USB C 4 in 1, Car Accessories Fast Charging Car Charger Adapter for iPhone 17 16 15 14 13 12 Pro Max, Samsung, Pixel | Travel Essentials Gifts for Men Women",0.00,USD,0,5.00
"Lamicall Cell Phone Stand for Desk - [360° Rotation] Sturdy Adjustable Desktop Phone Holder, Foldable Mobile Stand, Office Desk Accessories for iPhone 17 16 15 14 Pro Max Air, Galaxy S25, Cellphones",0.00,USD,0,5.00
"KTRIO Acrylic Cell Phone Stand Holder for Desk, Clear Phone Dock Cradle Compatible with iPhone 16/15/14/13 Pro Max 12/11 XR, All Smartphones, Office Accessories",0.00,USD,0,5.00
"40PCS Mini Magnetic Tiles Toddler Travel Essentials Toys with Case Set, Magnetic Building Blocks Kids Games, Montessori Preschool Education Sensory Toys for 3 4 5 Year Old Boys Girls Birthday Gifts",0.00,USD,0,5.00
"Dionis Goat Milk Skincare Lavender Blossom 6 Pc Self Care Essentials Travel Set - Bar Soap, Shave Butter, Hand Cream, Body Lotion & Whipped Sugar Body Scrub In Resealable Leak Resistant Carrying Case",0.00,USD,0,5.00
"Magnetic Phone Tripod, Aluminum Alloy Mini Foldable Tripod for Cell Phone, Travel Essential Adjustable Phone Stand for Desk/Handheld, Compatible with iPhone 17/16/15/14/13/12 Series, Black",0.00,USD,0,5.00
"Luxurious Baby Diaper Caddy, Nursery Storage Basket for Newborn Essentials, Travel Baby Basket for Diapers Baby Wipes, Organizer Tote Bag Storage Bin, Baby Shower Gifts(Beige)",0.00,USD,0,5.00
"Travel Neck Pillow for Airplanes, Premium Memory Foam Neck Pillow with Ergonomic 360° Support, Travel Essentials for Plane, Car, Train and Home, Max Black",0.00,USD,0,5.00
"NTONPOWER Wall Outlet Extender Surge Protector, 6 Outlet Extender with 3 USB Wall Charger (1 USB C), 3-Sided Outlet Splitter for Home, Travel, Dorm Essentials(White)",0.00,USD,0,5.00
"Portable Charger for Magsafe Battery Pack,10000mAh Power Bank with Foldable Stand,PD 22.5W Fast Magnetic Charge,Travel Essential Wireless Charger for iPhone 17/16/15/14/13/12 Series–Black",0.00,USD,0,5.00
"Self-Adhesive Makeup Bag – Portable Magic Cloth Cosmetic Pouch & Lens Wrap, Travel Organizer for Beauty Essentials, Gifts, and Daily Use,Blue,21.65inch",0.00,USD,0,5.00
"Magnetic Portable Charger, 10000mAh Power Bank, 20W Fast Charging for Magsafe Battery Pack, Travel Essential Wireless Charger Compatible with iPhone 17/16/15/14/13/12 Pro/Max/Air/Plus Series, Samsung",0.00,USD,0,5.00
"22oz Breast Milk Cooler Bottle – 24-Hour 360° Cooling Breastmilk Chiller with 2 Storage Bottles for Travel & Outdoor Use, Larger Capacity – Portable, Breastfeeding Essential Gift for New Moms",0.00,USD,0,5.00
"BAGSMART Travel Toiletry Bag, Puffy Large Toiletry Bag for Women, Lightweight Cosmetic Makeup Bag Organizer with Handle for Traveling, Accessories, Essentials, Toiletries (Green)",0.00,USD,0,5.00
"4-Pack Diaper Cream Spatula - Butt Spatula Baby 2 Large & 2 Mini Size with Travel Case, Soft Silicone Diaper Rash Cream Applicator for Newborn Baby Essentials",0.00,USD,0,5.00
"Blue Q Funny Pencil Case - Random C - Compact & Cool Pencil Pouch 4.25"" by 8.5"" Size, Chunky Zipper, 95% Recycled Plastic, Sturdy, Easy-to-Clean, Office Supplies & Travel Essential Holder",0.00,USD,0,5.00
"goodwipes Flushable Wipes - Individually Wrapped Butt Wipe for On-the-Go Adults - Portable Mini Wipes - Travel Essentials - Sewer & Septic Safe - Rosewater, 32 Count (1 Pack)",0.00,USD,0,5.00
Travel Size Art Coloring White Board for Kids 9”x12” Car Airplane Travel Essentials Kids Travel Accessories Travel Games for Kids Travel Toys for toddlers 1-3 Plane Travel Games for Kids Ages 4-8 & Up,0.00,USD,0,5.00
"Portable Charger 50000mAh Power Bank, Portable Phone Charger with 2 Built in Cables, 22.5W Fast Charging Travel Essentials Battery Pack for iPhone, iPad, MacBook, Android, Samsung Galaxy etc.",0.00,USD,0,5.00
"Baby Lounger & Nest for Newborn 0-24 Months, Baby Nest Supervised Breathable Cotton for Newborn, Newborn Essentials Gifts, Breathable Portable Infant Lounnger for Travel and Home(Cashmere Beige）",0.00,USD,0,5.00
Men Swim Trunks Compression Liner Quick Dry Drawstring Male Swimwear Swimsuit Swimtrunks Pattern Boardshorts,0.00,USD,0,5.00
"JARGO 3 in 1 Wireless Charging Station for Apple Devices, Foldable iPhone Charging Station for iPhone 17/16/15/14/13/12, Apple Watch & AirPods with Magsafe, Travel Essentials Wireless Charger (Black)",0.00,USD,0,5.00
"50000 mAh Portable Charger with Built in Cable & Wall Plug, Power Bank, 4 Outputs, 22.5W Fast Charging, Travel Essential Battery Pack with LED Display for iPhone 17/16/15/14 Series, Samsung, iPad",0.00,USD,0,5.00
"Round Mouse Pad, African American Women Girl Designs Non-Slip Rubber Base Gaming Mouse Pads and Coaster Set for Working Or Game, Desk Accessories, Cool Mouse Pad",0.00,USD,0,5.00
"knseva. XXL Mouse Pad (31.5"" x 15.8"")- Majestic Roar of a Lion Inspirational Quotes Warrior Whispers to Fate I am The Storm, Extra Large Office Accessories, Premium Stitched Anti-Slip Gaming Desk Mat",0.00,USD,0,5.00
"WENSHUO Abstract Square Face Pen Holder, Modern and Minimalistic Desk Accessories (Crème)",0.00,USD,0,5.00
24 Set Resin Dumpster Trash Shape with Fire Gift Team Employee Appreciation Gift Emotional Desk Accessories for Staff Teacher Office Coworker Nurse Medical Volunteer Favor (Classic Color),0.00,USD,0,5.00
"Large Mouse Pad Desk Mat for Home Office, Gaming Mousepad Extended Desk pad - Computer Keyboard Mouse Mat with Non-Slip Base and Stitched Edge Office Desk Organizers and Accessories",0.00,USD,0,5.00
"Remote Control Holder with 5 Compartments, KENOBEE Anti-slip Desktop Caddy Storage Organizer for Remote Controllers, Office Supplies, Makeup Brush, Media Accessories, Gray",0.00,USD,0,5.00
"Miniature Frog Figurines - Funny Frog Sculpture for Shelf, Desk Decoration - Frog Desk Accessories - Perfect Cute Frog Gift for Frog Lovers (Red Sofa)",0.00,USD,0,5.00
"Label Holder for Rolls and Fan-Fold Labels, Thermal Sticker Holder for Desktop Thermal Printer, Shipping Label Stand Desktop Label Printer Accessory Supplies for Home, Office, Small Business",0.00,USD,0,5.00
"Business Card Holder for Desk, Acrylic Business Card Organizer , Multiple 6 Slots 3 Tier Business Cards Stand for Women& Men,Office Desk Accessories,Organize 300 Cards-1 Pack(Horizontal,Clear)",0.00,USD,0,5.00
ZHANTUONE Dental Life Round Mouse pad with Non-Slip Rubber and Stitched Edges Desk Accessories Office Gifts for Women Friends Besties Daughter Graduation Friendship Birthday Gifts Funny Mouse pad,0.00,USD,0,5.00
"Menkxi Funny Desk Signs for Office, Novelty Nameplate Office Decor Black Desk Plaque for Women Men Coworker Gift Home Supply Accessories, 10 x 2 Inch(Chaos Coordinator)",0.00,USD,0,5.00
Business Card Holder for Desk - Business Card Display Holder - Made of White Carrara Marble - Desk Organizer Stand for 25 Business Cards - Cute Office Desktop Accessory for Men and Women,0.00,USD,0,5.00
"2 Pack Cell Phone Stand for Desk [Height Adjustable & Upgraded Stable Base] Foldable & Non-Slip Silicone Pad Phone Holder, iPhone Stand for All Phones, iPhone, iPad Stand | Office Desk Accessories",0.00,USD,0,5.00
I Work Hard So My Cat Can Have Nice Things - Funny Cat Lover Present - Pink Mouse Pad - Office Desk Accessories - Cubicle Decor,0.00,USD,0,5.00
"Tasybox Acrylic Letter Paper Organizer, Clear Desk Organizer Tray Stackable Desk Accessories Tray for School Home Office Supplies",0.00,USD,0,5.00
"Cute Popcorn Miniature Frog Figurines - Funny Frog Sculpture for Shelf, Desk Decoration - Frog Desk Accessories for Frog Lovers (Pink)",0.00,USD,0,5.00
"50 PCS Cross Paper Clips for Bible Study, Rose Gold Desk Accessories Christian Christmas Stocking Stuffers Gifts for Women",0.00,USD,0,5.00
"Koi Fish Desk Mat Gaming Koi Pond Desk Pad Large Cute Mouse Pad, Goldfish Mouse Mat XXL Laptop Keyboard Pad, Blue Waters Gamer Mouse Pad Full Mousepads Cool Office Accessories 31.5""x15.7""",0.00,USD,0,5.00
"Boss Day Gift, Funny Boss Decor - Work Forecast Office Decor for Men and Women Coworkers, Humorous Desk Decorative Sign, Coworker Gifts, Sarcastic Cubicle Accessories for Work",0.00,USD,0,5.00
"BUBM 3pcs Double Layer Electronic Organizer, Travel Gadgets Bag for Cables, External Flash Drive, Mouse, Memory Card, Power Bank and More, Compact and Multi-purpose, Black",0.00,USD,0,5.00
"Kitchen Scissors for Food - Heavy Duty Stainless Steel Shears - All Purpose Utility Shears - Cooking Scissors for Meat, Chicken, Fish, Vegetables, Herbs - Kitchen Gadget",0.00,USD,0,5.00
"MODL Infinity Tool™ 2.0 Modular Straps (4-Pack) - Flexible Multi-Tool, Gear Strap, Wearable Gadget for Outdoor Adventure, Survival, Camping, Travel, EDC",0.00,USD,0,5.00
"Lamicall 12Pack Rotatable Cord Organizer, Office Desk Nightstand Accessories - Cable Clips Management, Birthday Gifts for Teens Friends, Desk Phone Charger Holder Gadget, Home Workspace Organizer",0.00,USD,0,5.00
"Storage Theory 2-in-1 Measuring Cups & Spoons Set - Space-Saving Nesting Kitchen Gadget for Baking, Cooking & Coffee - Food Grade Plastic Measuring Tools - White/Gray",0.00,USD,0,5.00
"Makerstep Silicone Trivet Mat 3 Set in Heart Design Trivets. Hot Pan Holder Hot Pads for Countertop & Table. Non Slip, Serving Dishes Plates. Dishwasher Safe, Heat Resistant Kitchen Gadgets, Black",0.00,USD,0,5.00
"BUBM Electronic Organizer, Double Layer Travel Gadget Carry Bag for Cables, Plugs, Earphone, Flash Hard Drive and More--a Sleeve Pouch for iPad Mini(Medium, Black)",0.00,USD,0,5.00
"Car Gear Shift Hoodie, Fashionable Gear Shift Knob Cover, Mini Hoodie for Auto Shifter, Auto Interior Cute Gadgets, Universal Car Decoration Accessories",0.00,USD,0,5.00
"THE BATTERY ORGANISER Storage Case with Tester, Stores & Protects Up to 180 Batteries, Hinge Clear Cover with Locking Lid, Garage Gadget Organization Holds AA AAA C D and More, Gray",0.00,USD,0,5.00
"Lifewit Large Silverware Drawer Organizer, Plastic Cooking Utensil Tray for Kitchen, Expandable From 21 to 36 Inches, Adjustable Flatware Cutlery Spoon Fork Knife Spatula Gadgets Holder, Black",0.00,USD,0,5.00
"Silicone Under Sink Mat 34"" x 22"", kitchen Essentials and Gadgets, Shelf liner and Cabinet Protector, Home Organizers and Storage, Waterproof Bathroom Tray",0.00,USD,0,5.00
Kitchen Conversion Chart Magnet - Measurements Conversion Chart - Baking Supplies Baking Accessories Cooking Gadgets - Baking Kitchen Cooking Gifts for Women - Kitchen Gadgets,0.00,USD,0,5.00
"Zulay Kitchen Silicone Utensil and Spoon Rest with Drip Pad for Multiple Utensils, Heat-Resistant, BPA-Free & Spoon Holder for Stove Top, Kitchen Gadget Holder, Ladles, Tongs, Cooking Spatula & More",0.00,USD,0,5.00
"UL Listed USB Wall Charger Block (5W, White, 1pcs), 5V 1A Power Adapter for Outlet, Plug for Cell Phones, Tablets, Earphones, Power Banks, Smart Wearables, Toys and More Electronic Gadgets",0.00,USD,0,5.00
"Cord Holder, Cable Clips Cord Organizer 8 Pack Clasp Lock Christmas Decor Gifts Cable Organizer Clips Cord Holder for Nightstand Home Office Desk Accessories Kitchen Gadgets Essentials, Bread Machine",0.00,USD,0,5.00
"Survival Kit Advent Calendar 2025 for Adult Men Teen Boys - 24 Days Fun Christmas Countdown Outdoor Gadget for Hunting Camping Fishing, Xmas Cool Unique Adventure Gift for Teenager Husband Dad",0.00,USD,0,5.00
"1110 Tool Pouch Bag, Heavy Duty Small Tool Bag with YKK Zipper, Multipurpose Storage Pouch for Tools, Gadgets, Cosmetics, Stationery, Travel Accessories (3 Pack)",0.00,USD,0,5.00
Heartland Home Porcelain Nesting Spoon Rest for Stove Top or Counter. 2pc Cooking Spoon Holder (Big/Little). Utensil Rest and Small Spoon Rest. Smart Kitchen Gadget,0.00,USD,0,5.00
"Madesmart Classic 4-Compartment Drawer Organizer Gadget Tray, Plastic Multipurpose Storage Bin for Drawers, Granite",0.00,USD,0,5.00
"Heated Ice Cream Scoop with Holder(Newest Gen 3.0): USB Rechargeable Electric Icecream Scooper with Manual On/Off Switch,2025 Kitchen Gadgets for Hard Ice Cream, Waterproof IP67,Max to 158℉",0.00,USD,0,5.00
Office Chair Caster Wheels Gaming Chair 3 inch Replacement Rubber Chair Casters for Hardwood Floors & Carpet - Smooth & Quiet - Desk Chair Casters - Set of 5,0.00,USD,0,5.00
"Scosche PowerVolt 20W USB-C Charger Block, Type-C Charger Fast Charging Power Adapter Plug Compatible with Apple iPhone 16/15/14/13/12 Series, iPad and Android, Cell Phone Wall Chargers 2 Pack, White",0.00,USD,0,5.00
"Burga Airpods MAX Case, Compatible with Apple Airpods MAX Cover, Cute Protective Air Pods Hard Plastic Shell, Headphones Ear Covers, Stylish Design Smartphone Accessories",0.00,USD,0,5.00
"Resin Cat Figurine Phone Stand - Sturdy Design to Hold Smartphones Without Tipping, Cute Phone Holder Gift for Cat Lovers, Desk Decor Accessory 5.7 oz 3.3 x 2.3 x 2.0 in",0.00,USD,0,5.00
"Romuto Gym Magnetic Phone Holder for MagSafe, Dual Magnetic Phone Holder for Gym Accessories Attach to Metal Surface for iPhone 16 15 14 13 Pro Max Cell Phone Automobile Cradles",0.00,USD,0,5.00
"Gym Magnetic Phone Holder, Magnetic Phone Holder for Gym Magnetic Phone Mount Fit for Metal Surface for Golf Carts Kitchen Gym Accessories for Men Women Compatible with 4.7-6.5"" Smartphones",0.00,USD,0,5.00
"3 in 1 Charging Station for Apple, 15W Fast Magnetic Wireless Charger Station with Night Light, Travel Accessory Mag-Safe Stand for iPhone 17 16 15 14 13 12 - Apple Watch - AirPods(Adapter Included)",0.00,USD,0,5.00
"12Pcs Phone Charm Hook Adhesive Metal Phone Finger Grip Hook Cell Phone Ring Holder Stand for DIY Accessories (Silver, Heart Shaped)",0.00,USD,0,5.00
"CreaDream Acrylic Cell Phone Stand, 5mm Thicker Clear Cell Phone Holder, Transparent Phone Stand for Desk, Desktop, Desk Accessories, Suitable for iPhone 14 13 Pro Max, All Smartphone 4-8inch",0.00,USD,0,5.00
"Ultra-Strong Magnetic for MagSafe Wallet for iPhone All Series RFID Leather with Adjustable Stand 5 Card Holder for iPhone 17/16/15/14/13/12 and Pro/Promax,Gifts for Men, Men's Accessories",0.00,USD,0,5.00
"-10pcs- JW Verses Premium 3D Stickers - Accessories of Cell Phone, Ministry Supplies - for JW, Jehovah Witness Gifts, JW.org, Men, Her and Women (VM 10)",0.00,USD,0,5.00
Kids Water Shoes Boys Girls - Wide Toe Box Quick Dry Barefoot Shoes Breathable Non Slip Aqua Athletic Sneakers for Swim Beach Pool Kayak Hiking Sand Walking Travel Essentials (Little Kid/Big Kid),0.00,USD,0,5.00
"Disney Princess Icons Ceramic Camper Mug | BPA-Free Travel Coffee Cup For Espresso, Caffeine, Cocoa, Beverages | Home & Kitchen Essentials | Cute Gifts and Collectibles | Holds 20 Ounces",0.00,USD,0,5.00
IMclean-USB Cable 6',0.00,USD,0,4.00
Ecally 3 Pcs Phone Charms Strap Camera Charm Strap Pearl Beaded Butterfly Bow Flower Phone Wrist Lanyard Bracelet for Camera Keychain Wallet Pendant Decor,0.00,USD,0,4.00
"Bluetooth Headset with Microphone, Wireless Earpiece with Charging Case for Cellphones, PC, Single Ear Headset with Mute for Trucker Driver, Remote Work",0.00,USD,0,3.00
Cats in Space Cute Desk Keyboard and Mouse Pad Xl Extended Large Gaming Mouse Pad - Cat Desk Pad Gamer Girl Desk Accessories - Computer Laptop Keyboard and Mouse Mat Desktop Protector - 31.5 X 15.7 In,0.00,USD,0,0.00
