Title,Price,Currency,Seller FB,Signals
Sharper Image Powerboost Sport Percussion Handheld Massager: Metal,24.64,USD,750495,0
Acer 27 ED273 Abidpx,172.00,USD,652095,0
"Deco Gear 49"" Curved Ultrawide 3840x1080, 32:9 144Hz FreeSync 4ms Gaming Monitor",412.00,USD,652095,0
Logitech G PRO TKL Wired Mechanical GX Blue Clicky Gaming Keyboard w/ RGB,52.99,USD,453660,0
"Acer PM1 15.6"" FHD IPS 1080p Portable Monitor 60Hz 5ms USB-C Mini-HDMI PM161Q J",58.05,USD,396007,0
6 speeds Massage Gun Percussion Massager Deep Tissue Muscle Vibrating Relax,15.99,USD,350273,0
"Sceptre Curved 27"" 240Hz Gaming Monitor (Black)",182.99,USD,199420,0
"Exerscribe Vybe Pro Muscle Massage Gun for Athletes for Body,Back,Shoulder Pain-",42.99,USD,177287,0
NEW BWC2-H GasAlert Portable Gas Monitor Detector H2S Hydrogen Sulfide 24 Months,112.95,USD,130033,0
Dyson V8 Origin+ Cordless Vacuum | Purple | Refurbished,169.99,USD,119669,0
Dyson V10 Animal+ Cordless Vacuum Cleaner | Purple | Refurbished,219.99,USD,119669,0
Dyson V11 Cordless Vacuum Cleaner | Iron/Blue | Refurbished,229.99,USD,119669,0
Dyson V15 Detect Absolute Cordless Vacuum | Iron/Gold | Refurbished,339.99,USD,119669,0
6 Speed Massage Gun Percussion Massager Deep Tissue Muscle Vibrating Relax,14.99,USD,99837,0
Shark IZ340H Pet Pro Cordless Stick Vacuum (Certified Refurbished),129.99,USD,96623,0
"Acer 16"" PM161QC Portable Widescreen LCD Monitor FHD 1920×1080 60Hz Refurbished",40.49,USD,85756,0
"AOpen 15.6"" Portable Monitor 16PM1Q Jbmiuux FHD 1920x1080 60Hz 6ms Refurbished",43.19,USD,85756,0
"Acer 15.6"" Portable Monitor PM161Q LCD 1920 x 1080 60 Hz 250 Nit Refurbished",47.99,USD,85756,0
"Lifelong G70 15.6"" FHD 1080p 60Hz 6ms Portable Monitor w/ USB-C and Mini HDMI",55.99,USD,76856,0
"Helix 14"" Portable Monitor: IPS Panel, 1920x1080, USB-C & Mini HDMI ETHMON14",129.99,USD,76856,0
"Packard Bell airFrame 15.6"" Dual Screen Portable Full HD Monitor M15888",139.99,USD,76856,0
"BenQ MOBIUZ EX3210U 32"" 4K HDR 1ms Gaming Monitor 144Hz HDMI DisplayPort",413.00,USD,74371,0
"Milwaukee 0880-20 M18 18 Volt  Cordless Wet/Dry Vacuum, Tool Only,",99.00,USD,72476,0
RGB PC Gaming Keyboard Mouse & Headset Set LED Gamer Bundle Mechanical Kits 4IN1,36.90,USD,69786,0
eufy S320 Smart Sock Baby Monitor Track Sleep Heart Rate AI Cry Detect Notified,56.99,USD,67864,0
"ViewSonic VG1655-S 15.6"" 16:9 Portable IPS Monitor - Certified Refurbished",128.79,USD,53739,0
Mobile Pixels MPDUEXMAXDS-RB 14'' DuexMax Portable Monitor Certified Refurbished,156.39,USD,53739,0
"ViewSonic VG1656N-S 16"" 1200p IPS Portable Monitor Black - Certified Refurbished",202.39,USD,53739,0
SABINE WREN SPOTLIGHT RARE+UNCOMMON 20 CARD SET-TOPPS STAR WARS CARD TRADER,1.49,USD,48138,0.00
SABINE WREN SPOTLIGHT W2-SR+R+U 30 CARD SET-TOPPS STAR WARS CARD TRADER,5.99,USD,48138,0.00
Yunzii YZ-84 Mechanical Keyboard - Wired - Mint (with Extra keys) Yellow switche,39.99,USD,45049,0
"Wired Mechanical Keyboard, Mini Gaming Keyboard (Black-Yellow, Brown Switches)",25.99,USD,38915,0
ROYALAXE R100 Mechanical Keyboard Gateron G Pro 3.0 Yellow Switch - Lava Brown,46.76,USD,36459,0
Ninja Espresso Machine Luxe Café Premier Series Drip Coffee Maker - Silver,499.00,USD,36459,0
"(White) Gaming Mechanical Keyboard 87-Key | Blue Switch, Wired, Aluminum Frame",19.99,USD,25524,0
TOLOCO Deep Tissue Massage Gun for Muscle Pain Relief Quiet Percussion Massager,29.99,USD,25524,0
"Massage Gun Deep Tissue, Muscle Massage Gun with 9 Attachment Heads 20 Speeds",28.99,USD,24975,0
On-Stage SMS4500-P Desktop Monitor Stands Make Offer! Best Deal on ebay!,49.99,USD,19702,0
Topps NBA Living Set Dirk Nowitzki #5 - Presale,5.75,USD,19346,0.00
"Topps Living Set Dominic Canzone #886, Luke Keaschall #887 - Presale",11.50,USD,19346,0.00
DROP CSTM80 RGB TKL Wired Mechanical Gaming Keyboard - White,66.99,USD,18858,0
2025 DONRUSS WNBA COLLECTION 1-100 STARS ROOKIE CARDS RC YOU PICK,7.00,USD,18320,0.00
"AULA F75 Pro Wireless Mechanical Keyboard,75% Hot Swappable Custom",60.80,USD,16095,0
[Sealed] ONE PIECE CARD GAME BASE SHOP LIMITED CARD COLLECTION Vol.1 Japanese,83.99,USD,15540,0.00
Turonic GM5 Massage Gun - Deep Tissue Massager for Muscle Relax & Pain Relief,189.97,USD,14142,0
104-Key Mechanical Gaming Keyboard Easterntimes Tech 1-970 ET 🔥New🔥,21.99,USD,13342,0
TOPPS NOW NOVEMBER 26 GOLD+SILVER 20 CARD SET 2025 TOPPS MARVEL COLLECT DIGITAL,3.25,USD,13058,0.00
ASUS Mechanical Gaming Keyboard ROG Claymore Cherry MX Brown,49.99,USD,12850,0
Mechanical Gaming Keyboard - TBI Pro X107 Mechanoid - Authentic Blue Switches,19.99,USD,10895,0
Quiet Mechanical Gaming Keyboard 12 Multimedia 104 Keys Ergonomic Design USB-A,52.08,USD,10535,0
"VTech VM819 Baby Monitor with Camera and Audio, 2.8” Screen Portable Baby Camera",39.99,USD,9953,0
"99 Key Mechanical Keyboard, Tri-Mode Bluetooth/2.4G/USB-C Hot Swappable Custo...",39.95,USD,8410,0
Akko X Monsgeek Bun Wonderland MG108B V3 Pro Mechanical Gaming Keyboard  (#1),59.99,USD,6925,0
Dustsilver D66 Wireless Mechanical Keyboard Peach,39.99,USD,6907,0
Air Quality Monitor Pollution Sensor Best Outdoor Portable Monitoring PM2.5 10,32.00,USD,5970,0
Easterntimes Tech I-601 Mechanical Gaming Keyboard /Black,25.99,USD,5348,0
45Kpa Cordless Vacuum Cleaner 550W Lightweight Stick Vacuum Cleaner Rechargeable,84.99,USD,5344,0
SUMMER BEST VIEW DIGITAL COLOR VIDEO PORTABLE MONITOR 28280 ZOOM/PAN SOUND LIGH,59.99,USD,5328,0
"15.6"" Portable Display UPERFECT 1080P Best Gaming Monitor Type C w/Leather Case",59.99,USD,4344,0
Topps Marvel Collect TOPPS NOW 2025 November 26 Gold And Silver 20 Cards,3.25,USD,4127,0.00
"UPERFECT 24"" USB-C Portable Monitor 1920x1080 120Hz Display For Raspberry PI PS",129.99,USD,3957,0
"JLab Epic Mechanical Wireless Keyboard, Bluetooth, 2.4G, Switches, Illuminated",64.99,USD,3710,0
"Used | UPERFECT 18.5"" 100Hz Portable Monitor Laptop Monitor USB C Gaming Display",59.99,USD,3599,0
"UPERFECT 18.5"" Portable Monitor 1920x1080 Gaming Monitor HDMI Screen for PC Xbox",71.99,USD,3599,0
Best Portable Pedometer for Accurate Step Tracking and Calorie Counting,20.91,USD,3377,0
HK GAMING GK61 Mechanical Gaming Keyboard - 61 Keys Multi Color RGB Illuminated,17.99,USD,3345,0
"Tineco Pure One S11 Smart Cordless Stick Vacuum Cleaner | Lightweight, Quiet",95.20,USD,2363,0
Tineco Refurbished FLOOR ONE S5 Smart Cordless Wet-Dry Vacuum Cleaner,129.00,USD,2363,0
Topps Disney Collect Thanksgiving 2025 [ NO EPIC ],4.99,USD,2339,0.00
Corsair K70 RGB TKL Champion Series Optical Mechanical Gaming Keyboard,69.00,USD,1735,0
"VM819 Baby Monitor with Camera and Audio, 2.8” Screen Portable Baby Camera, Nigh",57.58,USD,1691,0
Mechanical Gaming Keyboard I-500 EasternTimes Tech,15.00,USD,1566,0
"Massage Gun Deep Tissue, 99 Speeds Quiet Handheld Electric Muscle Massager with",14.99,USD,1494,0
*NEW* RGP (Retro Game Plus) Transparent (ANBERNIC handheld sold by HAIHUANG),34.95,USD,1473,0.00
Summer Best View Digital Color Video Monitor R/C Camera 400 Ft Range Zoom In Out,26.25,USD,1330,0
"UPERFECT 15.6"" 60HZ 1920*1080 HDR IPS Portable Monitor Fr HDMI Input Laptop Used",28.99,USD,1297,0
RENPHO Massage Gun Deep Tissue Hand Held Massager Back Massager for Pain Relief,35.99,USD,1263,0
Replace Head Attachment For Deep Tissue Muscle Massager Massage Gun 12/18mm NEW,18.99,USD,1220,0
Cherry MX Stem Keycaps best gaming keycaps for your mechanical keyboard,10.99,USD,1163,0
Cherry MX Stem Keycaps best gaming for your mechanical keyboard MDX-21609-1,14.99,USD,1163,0
BEST Silent Disco Yoga STARTER Package: Portable Transmitter w/ Mic + Bluetooth,890.00,USD,1083,0
104-Key Mechanical Wired USB Keyboard Gaming ET EasterTimes Tech Full Size RGB,35.00,USD,1046,0
Bob and Brad Q2 Mini Massage Gun Muscle Massage Gun Deep Tissue For Pain Relief,45.95,USD,1000,0
TOPPS STAR WARS CARD TRADER SPOTLIGHT SABINE WREN EPIC/SR/R/UC SET,49.99,USD,966,0.00
Video Game Console Retro TV Stick 64G 4K HDMI 2 Wireless Controller 20000+ Games,17.99,USD,945,0.00
"15.6"" Portable Display EVICIV1080P Best Gaming Monitor Type C w/Leather Case AAA",62.99,USD,885,0
"Anbernic RG476H 4.7"" Android Retro Handheld",130.00,USD,856,0.00
75% Mechanical Gaming Keyboard Red Switch White Backlit 87 Keys TKL Wired,44.15,USD,836,0
Keyboard Custom Aluminum Mechanical Gaming Magnetic Switch 60%UltraFast Response,173.00,USD,710,0
"R75 Wired Gaming Keyboard with Volume Knob, 75% Mechanical Gaming Keyboard Cu...",114.31,USD,683,0
"12-In-1 Vegetable Chopper, Kitchen Gadgets with 7 Blades, Veggie, Food, Onion Ch",15.70,USD,626,0.00
"Custom Mechanical Keyboard (Sleek and Minimal, Creamy & Thocky!) READ DESC!",449.00,USD,422,0
AULA F75 75% Wireless Mechanical Keyboard Pre-lubed Reaper Switches RGB Backlit,44.99,USD,387,0
AULA F75 Pro Wireless Mechanical Keyboard w/Knob RGB Backlit Pre-lubed Switches,53.59,USD,387,0
AULA F99 Pro Wireless Mechanical Keyboard Tri-Mode RGB Backlit Gaming Keyboards,56.99,USD,387,0
K50 One-hand Mechanical Gaming Keyboard,21.00,USD,377,0
"BEST VALUE Optical Mechanical Gaming Keyboard ZIDLI ZGK01,Orange Backlight",46.99,USD,357,0
BEST Wired Optical Mechanical Gaming Keyboard & Mouse Rainbow RGB Backlit Combo,58.99,USD,357,0
Keychron K4 HE Special Edition 96% Wireless RGB Mechanical Keyboard Wood,800.00,USD,305,0
"Kitchen Funnel Set 4 Pack, Small and Large, Kitchen Gadgets Accessories Foldable",10.05,USD,303,0.00
🔥NEW🔥 Wooting 60HE+ BEST Gaming Keyboard with Rapid Trigger *IN STOCK*,244.99,USD,296,0
"R75 Mechanical Keyboard Wired with Volume Knob, 75% Custom Gaming Keyboard Ga...",93.41,USD,291,0
Mechanical Gaming Keyboard,20.00,USD,283,0
HyperX Alloy Elite 2 RGB Wired Mechanical Gaming Keyboard,50.00,USD,272,0
Mechanical Keyboard - NEW IN BOX - 68 Keys - Wired - white Color - Compact,25.00,USD,270,0
30 Speed Massage Gun Percussion Massager Deep Tissue Muscle Vibrating Relax,19.99,USD,257,0
Massage Gun Handheld Deep Tissue Percussion Muscle Massager 30 Speed 9 Heads,23.99,USD,257,0
Real Mechanical Keyboard 105 Keys RGB LED Backlit Wired Gaming Keyboard VG,77.77,USD,244,0
1x Home Kitchen Accessories Scoop Drain Gadgets Strainer Vegies Large-Tools,3.69,USD,230,0.00
K70 Mechanical Gaming Keyboard Cherry MX Blue.CH90000045-NA,59.95,USD,185,0
"Summer Portable Digital Video Baby Monitor System with 2.5"" Best View ...",39.99,USD,181,0
Summer Best view Digital Color Video Monitor Used Works Great,34.95,USD,128,0
"Baby Monitor with Camera and Audio, Screen Portable Baby Camera, Night Vision",62.99,USD,107,0
Green and White Mechanical Keyboard with Coiled Cable,60.00,USD,102,0
"Foldable Ab & Core Workout Machine for Home Gym, Ab Cruncher Exercise Equipment",149.99,USD,92,0.00
68% Mechanical Gaming Keyboard Ultra Compact Stand Alone Arrow Keys RGB,42.81,USD,88,0
Mini Muscle Massage Gun Protable Body Massager Deep Handheld Percussion Massager,9.99,USD,68,0
PRO Deep Tissue Massage Gun 16-Head Deep Percussion Muscle,41.99,USD,50,0
"Brand New Mechanical Keyboard Still In Original Packaging, With White Key Caps",20.00,USD,45,0
Dustsilver Mechanical Keyboard Model D84 Tested Fast Shipping,40.00,USD,45,0
Easterntimes Tech I-850 RGB Mechanical Gaming Keyboard,20.00,USD,43,0
Kitchen Gadgets Handy Stainless Steel Onion Holder,11.99,USD,40,0.00
Advanced Audio Baby Monitor - 1 Parent Unit with Portable Rechargeable Battery,34.99,USD,29,0
"GrowCube 14” Portable Lapdock Monitor w/ Keyboard – 1080P, Battery, Raspberry Pi",119.99,USD,28,0
"Best Gift VEOUT 16 60HZ Inch Gaming Portable Monitor for Laptop,1200P Display LC",156.99,USD,22,0
"Wireless Gaming Keyboard Mouse Combo, Mechanical Feel, LED Backlit, Black BEST",63.99,USD,19,0
Mechanical Keyboard - NEW IN BOX - 68 Keys - Wired - Mint Color - Compact,24.00,USD,18,0
"Custom Mechanical Keyboard (Creamy, Thocky And Quiet) Read Desc!",350.00,USD,13,0
16-head 16-Drive Massage Gun Se Deep Tissue Percussion Massager with 3 modes  30,80.99,USD,11,0
68% Custom Mechanical Keyboard TKL Lubed Hotswap Switches RGB,299.99,USD,9,0
Custom Mechanical Keyboard 60%,125.00,USD,8,0
Manual Egg Cracker Tool – Shell Separator Opener Kitchen Gadget for Easy Egg Bre,5.95,USD,3,0.00
Truly Ergonomic Cleave Keyboard - Best Ergo Split Tactile Optical Mechanical...,225.00,USD,3,0
15 inch type-c Tri screen Laptop dual screen extender 1080p display (EL Premium),550.00,USD,2,0
Portable HD Endoscopy Unit (HD Camera) Best Quality,3477.06,USD,2,0
"New 14"" Portable Monitor IPS HDR 1080P FHD USB C Screen",49.55,USD,0,0
Bakeneko65 Keyboard – ePBT “Less But Better” Keycaps + Gateron Milky Yellow Pro,280.00,USD,0,0
I build you a custom mechanical keyboard,300.00,USD,0,0
